{
    "platform_type": "vessel",
    "description": "SSRS18 small USV test platform",
    "name": "ssrs18",
    "length_over_all_m": 1.8,
    "breadth_over_all_m": 0.45,
    "mmsi_number": 265538760,
    "call_sign": "SLXX",
    "operational_limits": {
        "max_speed_knots": 6.0,
        "max_wind_speed_mps": 10.0,
        "max_wave_height_m": 0.3,
        "max_range_m": 1000,
        "endurance_hours": 2.0
    },
    "propulsion": [
        {
            "id": "main",
            "kind": "propeller",
            "x_forward_m": -5.0,
            "y_starboard_m": 0.0,
            "power_kw": 400
        },
        {
            "id": "main-rudder",
            "kind": "rudder",
            "x_forward_m": -5.8,
            "y_starboard_m": 0.0,
            "max_angle_deg": 35
        },
        {
            "id": "bow-1",
            "kind": "thruster",
            "x_forward_m": 5.5,
            "y_starboard_m": 0.0,
            "power_kw": 60,
            "thrust_kn": 8
        }
    ],
    "ccrp_m": {
        "x": 0.0,
        "y": 0.0,
        "z": 0.0
    },
    "frame_transforms": [
        {
            "parent_frame_id": "ssrs18-demo-frame-ccrp",
            "child_frame_id": "ssrs18-demo-frame-gnss-rutx",
            "sensor_type": "gnss",
            "sensor_description": "Rutx GNSS antenna",
            "translation_m": {
                "x": 0.27,
                "y": 0,
                "z": 0
            },
            "rotation_deg": {
                "yaw": 0,
                "pitch": 0,
                "roll": 0
            }
        },
        {
            "parent_frame_id": "ssrs18-demo-frame-ccrp",
            "child_frame_id": "ssrs18-demo-frame-gnss-anello",
            "sensor_type": "imu",
            "sensor_description": "Anello GNSS/INS (IMU + GNSS fusion)",
            "translation_m": {
                "x": -0.07,
                "y": -0.14,
                "z": 0
            },
            "rotation_deg": {
                "yaw": 0,
                "pitch": 0,
                "roll": -180
            }
        },
        {
            "parent_frame_id": "ssrs18-demo-frame-ccrp",
            "child_frame_id": "ssrs18-demo-frame-radar-aptiv",
            "sensor_type": "radar",
            "sensor_description": "Aptiv short-range radar",
            "translation_m": {
                "x": 0.105,
                "y": 0,
                "z": 0.08
            },
            "rotation_deg": {
                "yaw": 0,
                "pitch": 0,
                "roll": 0
            }
        },
        {
            "parent_frame_id": "ssrs18-demo-frame-ccrp",
            "child_frame_id": "ssrs18-demo-frame-lidar-os",
            "sensor_type": "lidar",
            "sensor_description": "Ouster OS lidar",
            "translation_m": {
                "x": 0.22,
                "y": 0,
                "z": 0
            },
            "rotation_deg": {
                "yaw": 0,
                "pitch": 0,
                "roll": 0
            }
        },
        {
            "parent_frame_id": "ssrs18-demo-frame-ccrp",
            "child_frame_id": "ssrs18-demo-frame-camera-axis-1",
            "sensor_type": "camera",
            "sensor_description": "Forward starboard camera (Axis)",
            "translation_m": {
                "x": 0.075,
                "y": 0.375,
                "z": 0.06
            },
            "rotation_deg": {
                "yaw": 0,
                "pitch": 0,
                "roll": 0
            }
        },
        {
            "parent_frame_id": "ssrs18-demo-frame-ccrp",
            "child_frame_id": "ssrs18-demo-frame-camera-axis-2",
            "sensor_type": "camera",
            "sensor_description": "Starboard camera (Axis)",
            "translation_m": {
                "x": 0.075,
                "y": 0.405,
                "z": -0.04
            },
            "rotation_deg": {
                "yaw": 90,
                "pitch": 0,
                "roll": 0
            }
        },
        {
            "parent_frame_id": "ssrs18-demo-frame-ccrp",
            "child_frame_id": "ssrs18-demo-frame-camera-axis-3",
            "sensor_type": "camera",
            "sensor_description": "Forward port camera (Axis)",
            "translation_m": {
                "x": 0.075,
                "y": -0.38,
                "z": 0.06
            },
            "rotation_deg": {
                "yaw": 0,
                "pitch": 0,
                "roll": 0
            }
        },
        {
            "parent_frame_id": "ssrs18-demo-frame-ccrp",
            "child_frame_id": "ssrs18-demo-frame-camera-axis-4",
            "sensor_type": "camera",
            "sensor_description": "Port camera (Axis)",
            "translation_m": {
                "x": 0.075,
                "y": -0.41,
                "z": -0.04
            },
            "rotation_deg": {
                "yaw": -90,
                "pitch": 0,
                "roll": 0
            }
        }
    ]
}
